R_eVzwqrYtKQZyFqR,Default Response Set,Anonymous,1,0,11/3/15 0:09,11/3/15 0:42,1,,,,1,,,,1,1,,,,,2,,4,1,1,1,1,1,1,1,1,1,1,1,1,1,1,1,1,1,1,1,1,1,1,1,1,1,1,1,1,1,1,1,1,1,1,1,1,1,1,1,1,1,1,2,2,1,1,2,2,1,1,2,2,1,2,2,2,1,2,1,2,2,2,75.415,46.627,33.084,71.025,44.958,45.274,58.115,34.866,52.007,69.201,43.753,68.113,74.364,47.381,49.532,38.324,42.14,62.105,40.488,34.339,73.459,65.427,40.108,6.538,72.36,45.827,47.495,36.443,40.073,59.895,32.367,44.346,32.303,31.4,69.264,43.343,42.534,55.886,32.85,50.157,73.459,65.427,40.108,64.595,72.36,45.827,47.495,36.443,40.073,59.895,32.367,44.346,32.303,31.4,69.264,43.343,42.534,55.886,32.85,50.157,1,1,1,4,1,1,1,1,1,1,1,1,1,1,1,1,1,1,1,1,5,2,4,3,2,2,3,2,2,3,4,2,1,1,1,1,1,4.5,no s,no,2.25,no s,140.625,24.438,67.029,62.718,56.5,26.03,19.613,59.042,57.136,52.167,135.409,19.613,59.042,57.136,52.167,2,1,1,1,1,4,,2,21,1,The one about keeping a secret from a lover.,Is it appropriate for you to keep a secret about your past relationship so you can keep your partner happy and keep the relationship alive?,1,,2,12,4,4,3,4,5,7,5,5,7,0,0,8,7,,Yes,1
R_3ZTB6iNzqGcx2Vn,Default Response Set,Anonymous,1,0,11/3/15 0:18,11/3/15 0:59,1,,,,1,,,,1,1,,,,,2,,4,1,1,1,1,1,1,1,1,1,1,1,1,1,1,1,1,1,1,1,1,1,1,1,1,1,1,1,1,1,1,1,1,1,1,1,1,1,1,1,1,1,1,1,3,1,3,2,2,3,1,2,2,1,2,1,1,1,1,1,1,2,2,46.886,73.219,48.051,39.731,21.429,62.899,54.975,63.666,76.034,47.056,52.797,48.559,60.121,63.895,24.264,46.261,41.264,46.717,69.451,34.607,42.076,44.642,50.775,46.827,54.034,58.515,22.668,43.348,37.86,44.031,65.176,71.421,32.891,46.583,3.327,19.822,61.056,53.4,60.469,73.15,42.076,44.642,50.775,47.792,54.034,59.171,22.668,44.438,38.733,46.134,68.193,71.421,32.891,46.583,37.466,19.822,61.056,53.4,60.469,73.15,1,1,1,2,1,2,1,2,2,2,2,1,1,1,2,1,1,1,1,1,3,2,2,3,2,3,3,3,3,2,3,5,1,1,1,1,1,18,1,Sê,$3.50 ,I don't know where to begin.No se!,315.266,34.373,25.267,356.67,98.323,293.708,30.791,18.408,5.035,22.638,293.708,30.791,19.046,349.897,78.966,1,1,2,10,2,4,,2,19,1,"senario de droga con malos effectos, senario de guerra,scenario de relacin y secretos",Is it appropriate that in order to maintain a secret in anterior relationship in order to maintain powered to make your partner happy and maintain a happy relationship?,1,,1,13,0,4,3,5,4,7,7,7,6,0,9,9,11,No,Yes,1
R_0rCyYnCOLxi0fqt,Default Response Set,Anonymous,1,0,11/3/15 0:41,11/3/15 1:18,1,,,,1,,,,1,1,,,,,2,4,,1,1,1,1,1,1,1,1,1,1,1,1,1,1,1,1,1,1,1,1,1,1,1,1,1,1,1,1,1,1,1,1,1,1,1,1,1,1,1,1,1,1,2,2,3,3,2,2,2,2,2,2,1,1,2,2,1,1,2,2,2,2,44.307,63.296,102.956,10.979,48.953,50.951,86.364,19.484,60.305,49.45,78.531,18.122,16.383,84.956,57.698,31.575,67.191,28.449,53.004,42.069,34.87,44.839,76.991,15.39,11.558,81.455,41.265,29.387,65.015,9.602,38.633,59.75,40.659,51.01,6.431,46.547,47.761,84.063,12.629,57.869,34.87,47.569,76.991,15.39,12.53,81.455,55.777,29.387,65.015,11.296,38.633,59.75,40.659,84.985,6.431,46.547,47.761,84.063,12.629,57.869,1,2,1,1,2,1,3,1,1,2,1,1,1,4,1,1,1,1,1,1,2,1,4,4,2,1,3,2,3,3,4,4,1,1,1,1,1,4,30,S,$2.25 ,3 horas,74.534,47.939,29.829,60.884,134.689,21.449,44.519,21.042,17.359,119.544,21.449,44.519,21.042,17.359,119.544,1,1,1,1,1,,4,1,19,2,,Is it appropriate to you to keep your previous relationship a secret to keep your partner happy and to keep the relationship alive?,1,,1,14,0,5,6,6,6,7,7,7,7,8,19,50,50,"I felt awkward answering some of the questions, I wish there was a ""no s"" option because I understood the question I just didn't know what I would be because the questions were more of in the moment type questions.",Yes,1
R_bO7W6QCnzizWUK1,Default Response Set,Anonymous,1,0,11/3/15 0:58,11/3/15 1:20,1,,,,1,,,,,1,,,1,Italiano,2,,4,1,1,1,1,1,1,1,1,1,1,1,1,1,1,1,1,1,1,1,1,1,1,1,1,1,1,1,1,1,1,1,1,1,1,1,1,1,1,1,1,1,1,2,2,2,2,2,2,2,2,2,2,1,1,2,2,1,1,2,2,1,1,8.782,98.99,17.269,5.631,10.835,62.954,6.785,20.701,11.721,18.084,72.435,18.118,8.144,9.357,4.635,35.09,18.933,8.157,31.302,5.575,7.468,7.816,67.631,12.419,5.82,8.128,3.158,31.882,17.434,4.073,17.425,97.243,4.439,15.657,4.359,6.463,61.28,5.377,18.748,7.315,7.468,7.816,67.631,15.378,5.82,8.128,3.158,31.882,17.434,4.073,28.819,97.243,4.439,15.657,4.359,6.463,61.28,5.377,18.748,7.315,1,1,1,2,1,1,1,1,1,1,2,1,1,1,1,1,1,1,1,1,4,2,4,4,1,1,3,2,4,3,4,3,1,1,1,1,1,3,1,Si,$2.25 ,3 horas,58.759,18.697,19.736,43.97,56.568,35.753,1.254,15.46,10.029,34.547,35.753,1.254,15.46,10.029,34.547,1,1,1,1,1,4,,2,19,2,,Is it appropriate to keep a secret from a previous relationship to be able to keep your partner happy in the current relationship?,1,,2,14,1,4,6,6,5,7,7,7,7,0,8,18,35,,Yes,1
R_6QXmsWmTGoOthRj,Default Response Set,Anonymous,1,0,11/3/15 1:43,11/3/15 2:14,1,,,,1,,,,1,1,,,,,2,4,,1,1,1,1,1,1,1,1,1,1,1,1,1,1,1,1,1,1,1,1,1,1,1,1,1,1,1,1,1,1,1,1,1,1,1,1,1,1,1,1,1,1,1,2,3,3,2,2,2,2,2,2,1,1,1,1,1,2,1,1,2,2,45.574,42.921,58.425,48.768,30.813,39.92,117.823,25.291,73.563,50.191,77.313,41.556,45.079,33.964,30.884,28.871,48.57,46.702,41.793,80.34,43.882,48.196,76.31,37.592,43.868,32.641,26.519,27.325,47.575,44.523,38.312,42.048,43.669,51.613,44.37,29.078,38.921,115.909,22.331,71.073,43.882,48.196,76.31,37.592,43.868,32.641,26.519,27.325,47.575,44.523,40.742,42.048,72.299,57.689,44.37,29.078,38.921,116.771,22.331,72.512,1,1,1,1,1,1,1,1,1,1,2,1,3,2,1,1,1,2,1,2,3,2,4,1,3,2,4,2,3,4,4,3,1,1,1,1,1,4,30,No,$2.25 ,5,56.221,48.401,29.939,29.954,63.626,52.874,13.862,10.703,6.946,29.417,52.874,41.927,10.703,6.946,29.417,1,2,1,1,1,,4,2,20,1,The situation about a mother aborting her baby because she is not ready to take care of it is familiar to blame just because it is such a popular topic in politics. ,Is it appropriate to keep a secret from your new partner about your previous relationship in order to be a happy pair and keep this relationship alive?,1,,1,18,0,4,4,4,4,7,7,7,7,20,5,8,32,,Yes,1
R_emt0sXMy9vD7cQ5,Default Response Set,Anonymous,1,0,11/3/15 1:53,11/3/15 2:27,1,,,,1,,,,1,1,,,1,Portugus,2,4,,1,1,1,1,1,1,1,1,1,1,1,1,1,1,1,1,1,1,1,1,1,1,1,1,1,1,1,1,1,1,1,1,1,1,1,1,1,1,1,1,1,1,2,2,1,2,2,2,1,1,2,2,1,2,1,2,1,2,1,1,2,2,61.189,32.008,49.91,36.893,25.893,40.065,72.021,78.485,65.099,29.311,47.639,49.773,68.77,74.391,39.908,25.088,41.574,62.282,17.632,25.239,49.959,28.351,45.96,48.966,67.624,56.141,38.778,23.916,40.576,59.962,16.032,31.123,24.292,48.974,30.129,25.265,36.749,65.241,77.306,61.2,49.959,28.351,45.96,48.966,67.624,73.175,38.778,23.916,40.576,59.962,16.032,31.123,24.292,48.974,30.129,25.265,36.749,65.241,77.306,61.2,1,1,1,1,1,2,1,1,1,1,1,1,1,1,1,1,1,1,1,1,4,2,5,4,2,2,3,2,2,3,3,2,1,1,1,1,1,9,29,No,$2.25 ,5 horas,93.321,96.221,41.369,38.93,28.481,2.532,1.933,2.116,5.383,1.697,2.532,84.543,2.116,5.383,1.697,1,2,1,1,1,,4,1,19,1,The ones about animal testing and about trying a new medical treatment on terminally-ill patients. ,Do you find it acceptable to keep your former relationship a secret in order to keep your current partner happy and your relationship with him/her going? ,1,,1,13,0,5,6,5,6,7,7,7,7,0,5,5,0,"There was one sentence that I thought didn't make sense (something like ""ÀCunto les beber...""), but this might have been my own lack of understanding. Otherwise, I thought the questions were really thought-provoking and am interested to know what the purpose of the study is. Thanks for the gift card!",Yes,1
R_2ruZR7s16e1Ycfz,Default Response Set,Anonymous,1,0,11/3/15 6:27,11/3/15 6:53,1,,,,1,,,,1,1,,,,,2,,4,1,1,1,1,1,1,1,1,1,1,1,1,1,1,1,1,1,1,1,1,1,1,1,1,1,1,1,1,1,1,1,1,1,1,1,1,1,1,1,1,1,1,1,1,1,2,2,2,2,2,2,2,1,1,2,2,1,2,1,2,2,2,16.416,22.122,25.67,92.054,8.643,7.748,24.704,38.299,32.049,31.49,6.952,15.543,23.737,7.828,20.231,26.773,13.507,41.027,22.772,30.665,13.998,23.582,4.818,14.541,22.576,6.684,18.924,25.51,12.241,39.861,21.691,20.648,29.371,24.462,90.471,7.343,6.445,23.407,36.379,29.899,13.998,30.265,4.818,14.541,22.576,6.684,18.924,25.51,12.241,39.861,21.691,20.648,29.371,24.462,90.471,7.343,6.445,23.407,36.379,29.899,1,2,1,1,1,1,1,1,1,1,1,1,1,1,1,1,1,1,1,1,4,3,4,2,3,2,3,2,2,4,4,2,1,1,1,1,1,6,30,No.,$2.25 ,Cinco horas.,73.903,62.795,29.552,24.365,62.792,25.723,57.195,27.005,5.723,53.453,25.723,57.195,27.005,5.723,58.192,1,1,1,1,2,4,,2,20,1,I have read about medical dilemmas (like the scenario where a doctor has to decide whether or not to give patients a medicine) because I am studying medicine. ,Is it appropriate for you to keep your previous relationship secret so you can protect your partner happy and keep your relationship alive?,1,,2,14,4,4,6,6,6,7,7,7,7,0,18,30,41,,Yes,1
R_eCF9YjLRdnEFWTj,Default Response Set,Anonymous,1,0,11/3/15 8:55,11/3/15 9:18,1,,,,1,,,,1,1,,,,,2,,4,1,1,1,1,1,1,1,1,1,1,1,1,1,1,1,1,1,1,1,1,1,1,1,1,1,1,1,1,1,1,1,1,1,1,1,1,1,1,1,1,1,1,1,2,2,2,2,2,1,1,2,2,1,1,2,2,1,2,1,2,1,2,18.417,37.06,31.832,9.394,38.842,25.135,45.236,61.645,56.17,24.221,37.468,28.571,28.473,49.98,16.171,25.342,43.241,26.099,22.858,24.587,16.139,21.761,34.851,26.736,14.082,48.379,13.642,22.964,42.03,24.153,20.93,34.024,22.361,30.253,6.879,37.237,23.414,41.967,60.054,50.375,16.139,21.761,34.851,26.736,26.054,48.379,15.328,22.964,42.03,24.153,20.93,34.024,22.361,30.253,6.879,37.237,23.414,41.967,60.054,50.375,1,1,1,1,2,1,2,1,1,1,1,1,1,1,1,1,1,1,1,1,5,1,5,3,1,2,4,1,1,5,5,1,1,1,1,1,1,4,30,No,$2.25 ,5,59.722,31.575,20.675,36.491,72.013,56.501,28.352,13.757,23.906,17.411,56.501,28.352,13.757,23.906,68.21,1,1,1,1,3,4,,2,21,1,The one about a doctor giving drugs and the one about swerving to avoid a mother and child.  ,Is it appropriate to hide your previous relationship so you can keep your partner happy and continue with the relationship?,1,,2,14,5,6,5,6,7,7,7,7,7,0,2,15,40,,Yes,1
R_b8dPcEvQbcATj9z,Default Response Set,Anonymous,1,0,11/3/15 9:44,11/3/15 10:03,1,,,,1,,,,1,1,1,1,1,"Vietnamita, Portugues, LSA",2,4,,1,1,1,1,1,1,1,1,1,1,1,1,1,1,1,1,1,1,1,1,1,1,1,1,1,1,1,1,1,1,1,1,1,1,1,1,1,1,1,1,1,1,1,1,1,2,2,2,1,1,2,2,1,1,2,2,1,2,1,2,1,2,4.777,7.435,6.875,8.713,10.13,4.281,5.089,6.59,4.435,6.136,4.813,6.865,3.801,8.199,7.886,5.494,6.032,13.862,13.514,10.91,3.833,5.238,3.973,5.965,3.042,7.123,6.909,4.656,5.193,12.834,12.222,5.08,10.045,4.072,7.87,8.847,2.865,3.766,5.824,3.627,3.833,5.238,3.973,5.965,3.042,7.123,6.909,4.656,5.193,12.834,12.222,6.11,10.045,4.072,7.87,8.847,2.865,3.766,5.824,3.627,1,1,1,1,1,1,1,1,1,1,1,2,1,1,1,1,1,1,1,1,5,2,4,2,2,1,4,2,1,5,4,2,1,1,1,1,1,4,29,No,2.25,5,121.667,36.012,16.479,66.537,120.334,32.285,14.085,2.798,1.798,1.39,111.873,31.228,11.123,54.552,116.099,3,2,4,4,9,,4,1,24,1,"The one regarding assassinating Hitler, as well as different variations on the crying baby and car/pedestrian situations.",It is acceptable for you to keep your previous relationship a secret in order to keep your partner happy and keep the relationship alive?,1,,1,14,1,6,5,6,6,7,7,7,7,5,10,20,15,,Yes,1
R_50CBwVnMOvpJm17,Default Response Set,Anonymous,1,0,11/3/15 10:07,11/3/15 10:47,1,,,,1,,,,1,1,,,1,Alemn,2,4,,1,1,1,1,1,1,1,1,1,1,1,1,1,1,1,1,1,1,1,1,1,1,1,1,1,1,1,1,1,1,1,1,1,1,1,1,1,1,1,1,1,1,1,2,1,2,2,2,1,1,1,2,1,1,2,2,1,2,1,2,1,2,83.434,62.482,30.787,58.166,34.141,43.008,108.261,59.395,115.994,60.203,43.619,61.618,49.008,75.481,36.216,130.165,52.773,106.274,73.858,52.374,78.552,57.03,42.167,60.018,47.291,56.476,34.835,126.569,51.212,62.932,70.787,60.893,51.132,28.372,45.054,29.916,30.495,106.218,50.646,113.931,78.552,57.03,42.167,60.018,47.291,56.476,34.835,126.569,51.212,104.423,70.787,60.893,51.132,28.372,45.054,29.916,30.495,106.218,50.646,113.931,1,1,1,1,1,1,1,1,1,3,1,1,1,1,1,1,1,1,1,1,4,2,4,2,2,4,3,1,2,4,4,1,1,1,1,1,1,4.5,30,S,2.25,1/6 / ,65.544,39.763,41.266,125.572,115.259,58.537,1.545,35.857,4.211,88.315,58.537,1.545,35.857,4.211,93.912,1,1,1,1,2,,4,1,21,1,The car/woman with child scenario,"Is it appropriate to keep a previous relationship a secret in order to maintain a current, happy relationship?",1,,2,13,1.5,6,6,6,6,7,7,7,7,8,8,31,20,,Yes,1
R_5jOUnIHTO3AXdd3,Default Response Set,Anonymous,1,0,11/3/15 10:06,11/3/15 11:36,1,,,,1,,,,1,1,,,,,2,,4,1,1,1,1,1,1,1,1,1,1,1,1,1,1,1,1,1,1,1,1,1,1,1,1,1,1,1,1,1,1,1,1,1,1,1,1,1,1,1,1,1,1,2,2,1,2,2,2,1,1,2,2,1,1,2,2,1,2,1,2,2,2,62.124,19.169,64.68,82.401,72.656,40.063,55.272,71.112,44.617,74.002,23.505,33.723,304.799,46.628,51.846,44.839,119.609,18.288,49.089,18.728,60.41,72.584,21.838,31.218,303.547,45.607,48.718,43.159,118.648,17.235,47.229,17.902,17.201,61.945,80.509,70.662,38.791,53.75,69.568,25.821,60.41,72.584,21.838,31.218,303.547,45.607,48.718,43.159,118.648,17.235,47.229,17.902,17.201,61.945,80.509,70.662,38.791,53.75,69.568,43.195,1,1,1,1,1,1,1,1,1,1,1,1,1,1,1,1,1,1,1,2,4,1,5,5,1,2,5,1,1,4,2,2,1,1,1,1,1,9,30,si,2.25,3,28.43,31.124,31.515,156.459,136.957,21.673,28.737,5.583,8.479,134.398,21.673,28.737,5.583,151.15,134.398,1,1,1,2,1,4,,2,20,1,All of the situations repeated themselves but with different circumstances,Is it appropriate to keep your previous relationship a secret to keep your partner happy and keep the relationship alive?,1,,2,5,1,6,7,6,5,7,7,7,7,0,20,30,0,,Yes,1
R_8cUn7T8Bn7fsqiN,Default Response Set,Anonymous,1,0,11/3/15 11:07,11/3/15 11:39,1,,,,1,,,,,1,,,,,2,,2,1,1,1,1,1,1,1,1,1,1,1,1,1,1,1,1,1,1,1,1,1,1,1,1,1,1,1,1,1,1,1,1,1,1,1,1,1,1,1,1,1,1,1,1,1,2,2,2,2,3,1,2,1,2,1,1,2,2,1,2,1,2,19.946,25.111,76.332,17.47,34.891,60.593,161.94,10.336,141.34,19.181,10.527,68.641,42.773,31.472,9.84,37.715,33.194,45.892,64.028,32.044,10.761,17.867,9.246,51.424,38.498,30.406,9.07,33.794,32.032,44.37,62.315,23.613,27.938,74.499,15.436,32.89,55.863,159.522,8.958,139.538,10.761,17.867,9.246,64.303,38.498,30.406,9.07,33.794,32.032,44.37,62.315,23.613,27.938,74.499,15.436,32.89,55.863,160.922,8.958,139.538,1,1,1,2,1,1,1,1,1,1,1,1,1,1,1,1,1,2,1,1,4,1,4,5,2,1,4,3,3,4,2,3,1,1,1,1,1,18,15,No,3.75,3,72.758,26.568,40.092,67.213,26.155,66.677,24.493,23.723,64.05,22.481,66.677,24.493,23.723,64.05,22.481,1,1,1,1,1,4,,2,19,1,Doing well in my classes to keep my financial aid.,Is is appropriate for you to keep your old relationship a secret to keep your partner happy and keep the relationship alive?,1,,1,18,0,5,5,6,6,7,7,7,7,38,38,63,50,,Yes,1
R_aWq9phYx2EvDc21,Default Response Set,Anonymous,1,0,11/3/15 11:28,11/3/15 12:21,1,,,,1,,1,coreano,1,1,,,,,2,4,,1,1,1,1,1,1,1,1,1,1,1,1,1,1,1,1,1,1,1,1,1,1,1,1,1,1,1,1,1,1,1,1,1,1,1,1,1,1,1,1,1,1,1,1,2,2,2,2,1,1,2,2,1,1,2,2,1,1,1,1,2,2,30.355,18.59,26.966,63.357,20.549,20.612,89.915,162.995,122.279,23.873,28.728,208.535,82.151,41.082,16.217,188.151,14.489,163.748,164.564,25.904,28.905,22.311,27.612,207.228,81.109,39.696,14.959,187.11,13.519,162.658,163.807,16.218,24.775,25.872,62.283,19.208,19.01,79.976,161.545,120.868,28.905,22.311,27.612,207.228,81.109,39.696,14.959,187.11,13.519,162.658,163.807,16.218,24.775,25.872,62.283,19.208,19.01,79.976,161.545,120.868,1,1,1,1,1,1,1,1,1,1,1,1,1,1,1,1,1,1,1,1,4,1,3,3,3,1,4,1,1,2,3,2,1,1,1,1,1,4,30,Si,$2.25 ,5 horas,175.71,410.136,26.805,61.135,195.812,7.466,8.356,7.22,4.095,11.171,9.655,8.356,7.22,4.095,11.171,2,1,1,1,1,,4,2,20,2,,Is it appropriate for you to keep your former relationship a secret in order to keep your partner happy and have the relationship survive?,1,,1,13,1,4,4,4,4,7,7,7,7,0,8,50,0,,Yes,1
R_3xghoZljlaAiufr,Default Response Set,Anonymous,1,0,11/3/15 13:31,11/3/15 13:56,1,,,,1,,,,1,1,,,1,Ruso,2,,4,1,1,1,1,1,1,1,1,1,1,1,1,1,1,1,1,1,1,1,1,1,1,1,1,1,1,1,1,1,1,1,1,1,1,1,1,1,1,1,1,1,1,2,2,2,2,2,2,1,1,2,2,1,1,2,2,2,2,2,2,1,2,41.991,52.493,83.271,29.627,11.307,27.703,32.231,71.444,25.12,54.223,105.821,9.274,10.708,82.937,15.577,55.257,43.911,20.414,62.506,15.893,33.761,52.534,45.119,7.197,7.802,81.202,14.198,54.281,42.765,6.7,26.977,51.122,13.64,82.187,28.383,9.259,26.329,19.501,51.214,23.592,33.761,52.534,45.119,7.197,7.802,81.202,14.198,54.281,42.765,6.7,26.977,51.122,13.64,82.187,28.383,9.259,26.329,19.501,51.214,23.592,1,1,1,1,1,1,1,1,1,1,1,1,1,1,1,1,1,1,1,1,3,1,3,1,1,1,3,1,1,5,3,2,1,1,1,1,1,12,15,S,$2.25 ,6 horas?,23.604,22.218,16.806,100.129,75.332,1.739,14.97,7.789,49.685,33.333,18.263,14.97,7.789,93.786,71.039,3,1,1,2,2,4,,2,22,1,Some of the first 20 questions were similar just slightly different.,It it appropriate for you to keep a secret from your relationship so you can keep your partner happy and keep alive the relationship?,1,,2,15,1,6,7,7,5,7,7,7,7,0,10,30,40,,Yes,1
R_8jhE1ATcyqh0UtL,Default Response Set,Anonymous,1,0,11/3/15 14:06,11/3/15 14:34,1,,,,1,,,,1,1,,,,,2,,4,1,1,1,1,1,1,1,1,1,1,1,1,1,1,1,1,1,1,1,1,1,1,1,1,1,1,1,1,1,1,1,1,1,1,1,1,1,1,1,1,1,1,1,3,3,3,2,2,1,1,3,2,1,2,2,2,1,1,1,2,3,1,60.748,74.901,53.02,22.831,47.074,10.077,46.696,12.405,69.22,34.734,44.398,17.693,6.052,45.368,55.26,6.595,49.71,18.266,33.506,35.7,46.893,33.634,42.768,12.984,3.547,13.535,38.398,4.346,47.903,14.236,0.011,55.812,27.139,5.147,15.391,40.842,8.772,8.256,8.803,12.873,46.893,33.634,42.768,12.984,3.547,44.438,53.708,4.346,47.903,14.236,32.068,65.193,27.139,51.777,21.433,40.842,8.772,44.588,8.803,67.656,1,1,1,1,1,2,2,1,1,1,4,2,1,5,2,1,1,5,1,2,3,2,4,4,2,2,4,3,4,2,2,4,1,1,1,1,1,9,9,Si,$2.25 ,3,78.387,49.825,19.379,52.837,61.889,7.217,13.241,6.057,4.675,30.706,74.471,45.463,6.057,41.059,59.228,3,3,1,2,2,4,,1,21,1,A few seemed familiar in that they were repeated more than once,Is it appropriate for you to keep your previous relations a secret to keep your partner happy and keep the relationship alive?,1,,2,14,5,5,4,6,4,7,7,7,6,0,2,5,2,,Yes,1
R_4MzsiBiKJJfnRvT,Default Response Set,Anonymous,1,0,11/3/15 14:37,11/3/15 15:04,1,,,,1,,,,1,1,,,1,Urdu,2,4,,1,1,1,1,1,1,1,1,1,1,1,1,1,1,1,1,1,1,1,1,1,1,1,1,1,1,1,1,1,1,1,1,1,1,1,1,1,1,1,1,1,1,2,1,2,2,2,2,1,1,1,1,1,1,2,2,2,2,1,2,2,2,26.759,43.285,45.389,109.313,23.035,80.11,67.688,21.575,77.371,18.502,17.658,12.672,42.86,60.889,20.643,29.455,46.497,59.386,28.891,50.12,9.609,17.54,2.801,3.116,12.94,16.31,18.586,8.592,12.899,8.107,23.198,9.476,11.635,9.038,7.635,4.287,11.497,10.779,20.416,11.006,25.364,17.54,15.836,11.474,41.041,59.773,18.586,28.145,45.051,56.835,27.729,42.174,48.529,44.853,101.036,21.534,78.492,66.475,20.416,75.239,7,1,7,4,10,10,1,7,7,10,4,12,15,11,28,7,14,22,1,26,3,3,3,3,3,3,3,2,3,3,3,3,1,1,1,1,1,18,30,No,La ensalada cuesta $2.50.,6 horas. ,71.789,50.411,26.587,38.222,71.508,1.987,3.803,2.074,1.505,1.322,62.59,41.911,2.074,1.505,65.155,6,13,1,1,8,,4,1,26,2,,It is appropriate for you to keep your previous relationship to keep your partner happy and a good relationship. ,1,,1,20,0,2,3,3,3,7,7,7,7,0,0,11,7,None. ,Yes,1
R_1SbQVIBIpQzTEax,Default Response Set,Anonymous,1,0,11/3/15 14:45,11/3/15 15:07,1,,,,1,,,,1,1,,,,,2,4,,1,1,1,1,1,1,1,1,1,1,1,1,1,1,1,1,1,1,1,1,1,1,1,1,1,1,1,1,1,1,1,1,1,1,1,1,1,1,1,1,1,1,1,1,1,2,2,2,2,2,2,2,1,1,2,2,1,2,1,2,1,1,16.411,40.45,37.469,14.363,31.472,32.104,70.21,21.733,61.824,24.529,66.613,24.658,40.088,15.097,28.513,13.38,7.337,54.076,59.23,14.823,15.508,22.835,65.552,23.27,39.001,14.179,27.587,12.668,6.208,53.158,58.473,39.524,13.29,36.824,13.437,30.512,31.246,63.726,19.952,60.906,15.508,22.835,65.552,23.27,39.001,14.179,27.587,12.668,6.208,53.158,58.473,39.524,13.29,36.824,13.437,30.512,31.246,64.75,19.952,60.906,1,1,1,1,1,1,1,1,1,1,1,1,1,1,1,1,1,2,1,1,4,1,5,1,1,1,4,2,2,2,4,4,1,1,1,1,1,9,30,Si porque rosas tienen ptalos y por lo tanto estan flores. ,La ensalada cuesta $2.25,No entiendo la pregunta. ,38.523,39.469,55.639,67.149,104.749,12.157,1.503,5.153,1.464,22.526,30.145,27.715,53.043,1.464,103.21,2,2,9,1,3,,4,2,24,2,,"Is it appropriate for you to keep a previous relationship a secret in order to maintain your new, happy relationship?",1,,1,19,2,2,4,6,5,7,7,7,7,0,0,4,0,,Yes,1
R_enytjAxIVPcOaSp,Default Response Set,Anonymous,1,0,11/3/15 15:18,11/3/15 15:53,1,,,,1,,,,1,1,,,,,2,,4,1,1,1,1,1,1,1,1,1,1,1,1,1,1,1,1,1,1,1,1,1,1,1,1,1,1,1,1,1,1,1,1,1,1,1,1,1,1,1,1,1,1,2,2,1,2,2,2,1,1,2,2,1,2,2,2,1,2,1,2,2,2,21.353,81.876,81.398,46.356,54.807,34.849,48.881,24.757,55.018,62.337,41.273,64.871,57.286,48.937,33.613,31.393,37.622,72.357,51.376,51.321,19.577,60.571,39.401,55.21,55.855,46.534,31.926,29.588,36.558,69.914,49.719,79.828,45.527,79.546,44.08,51.915,32.98,44.791,21.672,53.517,19.577,60.571,39.401,55.21,55.855,46.534,31.926,29.588,36.558,69.914,50.934,79.828,46.16,79.546,45.101,51.915,32.98,44.791,21.672,53.517,1,1,1,1,1,1,1,1,1,1,2,1,2,1,2,1,1,1,1,1,5,1,5,2,2,4,4,1,5,5,4,5,1,1,1,1,1,4,"No s que es ""decimoquinta.""",no,$3.25 ,À3 horas?,124.898,129.816,31.299,40.188,65.773,117.065,65.686,23.777,32.4,50.265,117.065,128.437,23.777,32.4,65.297,1,4,1,1,3,4,,2,22,1,"I participate in Azim Shariff's Culture and Morality Lab.  There, we often talk about moral dilemmas as measures of utilitarianism.",Is it appropriate for me to keep a previous relationship secret in order to keep my partner happy and stay in the relationship?,1,,1,14,0,2,6,5,5,7,7,7,7,0,0,5,5,I am very interested in the outcomes of this study and would love to hear about outcomes and further research.,Yes,1
R_9MkSVzjKT7pkYrr,Default Response Set,Anonymous,1,0,11/3/15 15:44,11/3/15 15:57,1,,,,1,,,,1,1,,,,,2,4,,1,1,1,1,1,1,1,1,1,1,1,1,1,1,1,1,1,1,1,1,1,1,1,1,1,1,1,1,1,1,1,1,1,1,1,1,1,1,1,1,1,1,1,1,1,1,1,1,1,1,1,1,1,1,1,1,1,1,1,1,1,1,27.589,2.094,32.492,2.157,16.776,10.483,36.216,2.238,2.093,4.831,38.086,7.324,2.064,11.967,2.273,2.311,2.522,2.63,19.039,23.742,25.267,1.978,37.199,1.59,1.298,5.956,1.543,1.434,1.846,0.982,18.018,1.327,22.784,28.645,1.481,16.099,9.123,34.316,1.243,1.378,26.645,1.978,37.199,1.59,1.298,11.168,1.543,1.434,1.846,1.791,18.018,1.327,22.784,28.645,1.481,16.099,9.123,34.316,1.243,1.378,2,1,1,1,1,3,1,1,1,2,1,1,1,1,1,1,1,1,1,1,5,5,5,5,5,5,5,5,5,5,5,5,1,1,1,1,1,6,31,Si ,5,4 horas,27.847,57.402,13.096,35.461,4.888,18.226,53.687,0,28.779,2.161,18.226,55.486,0,34.044,2.161,1,2,0,3,1,,4,2,18,2,,Is it appropriate for you to maintain secret your interior realtionship to be able to maintain a happy partner and to maintain the realtionship alive?,1,,2,5,0,6,7,7,7,7,7,7,7,15,26,77,12,,Yes,1
R_cTjQ8jPKkOvho7H,Default Response Set,Anonymous,1,0,11/3/15 15:44,11/3/15 16:05,1,,,,1,,,,1,1,,,,,2,,4,1,1,1,1,1,1,1,1,1,1,1,1,1,1,1,1,1,1,1,1,1,1,1,1,1,1,1,1,1,1,1,1,1,1,1,1,1,1,1,1,1,1,1,3,3,3,2,2,1,1,2,2,1,1,1,1,1,1,1,2,1,2,26.74,32.131,38.986,21.881,11.718,27.624,6.259,46.053,62.813,39.113,30.841,31.591,7.703,52.415,27.224,14.183,17.738,38.416,52.325,23.314,25.62,38.024,29.942,29.855,6.354,50.694,25.313,13.036,16.565,37.358,51.478,31.213,22.432,36.115,20.619,7.166,9.081,4.103,44.58,61.892,25.62,38.024,29.942,29.855,6.842,50.694,25.313,13.036,16.565,37.358,51.478,31.213,22.432,36.115,20.619,7.166,9.081,5.839,44.58,61.892,1,1,1,1,2,1,1,1,1,1,1,1,1,1,1,1,1,2,1,1,3,3,4,3,3,3,5,5,3,3,4,4,1,1,1,1,1,8,1,Si,2.25,64,73.38,17.859,26.708,40.12,36.947,15.476,10.512,23.668,3.928,14.049,21.808,10.512,23.668,3.928,14.049,3,1,1,1,1,4,,2,20,1,"The baby one, testing on animals, the military one, telling your partner",Is it appropiate for you to keep a secret to yourself in order to be able to keep your parter happy and maintain the relationship?,1,,1,13,0,6,6,6,6,7,7,7,7,2,0,2,1,,Yes,1
R_0JTBDF8gP08TAhL,Default Response Set,Anonymous,1,0,11/3/15 13:53,11/3/15 16:21,1,,,,1,,,,1,1,,,,,2,4,,1,1,1,1,1,1,1,1,1,1,1,1,1,1,1,1,1,1,1,1,1,1,1,1,1,1,1,1,1,1,1,1,1,1,1,1,1,1,1,1,1,1,1,2,3,3,2,2,2,2,1,2,1,1,2,2,1,2,1,2,2,2,7.542,15.538,6.898,9.875,6.509,6.025,8.005,6.858,26.933,13.591,8.58,4.963,7.924,17.048,12.967,13.916,16.293,9.704,12.719,16.933,6.745,10.049,3.59,3.766,3.543,4.674,10.168,11.061,15.446,7.921,11.828,3.876,9.159,6.195,8.421,4.334,3.682,4.72,4.071,26.206,6.745,12.569,3.59,3.766,3.543,5.586,10.168,11.061,15.446,7.921,11.828,3.876,9.159,6.195,9.085,4.334,3.682,4.72,4.071,26.206,1,2,1,1,1,2,1,1,1,1,1,1,1,1,2,1,1,1,1,1,3,3,3,3,3,3,3,3,3,3,3,3,1,1,1,1,1,12,1,No.,6.5,2,4.15,17.753,8.592,17.081,26.266,3.242,10.795,5.634,4.964,17.645,3.242,10.795,5.634,4.964,17.645,1,1,1,1,1,,4,2,21,2,,Is it appropriate to keep a secret about a past relationship to keep your significant other happy and to keep the relationship alive?,1,,2,16,9,4,7,7,6,7,7,7,7,0,28,71,88,,Yes,1
