R_4JhRWhKD9XaVbgx,Default Response Set,Anonymous,1,0,10/21/15 17:52,10/21/15 18:19,1,,,,1,,,,1,1,,,,,2,,4,1,1,1,1,1,1,1,1,1,1,1,1,1,1,1,1,1,1,1,1,1,1,1,1,1,1,1,1,1,1,1,1,1,1,1,1,1,1,1,1,1,1,1,2,1,3,2,2,1,1,2,2,1,1,2,2,1,2,1,1,2,2,11.335,180.432,18.37,64.944,21.645,8.831,41.019,33.646,39.745,75.983,57.322,21.327,29.698,14.362,20.004,18.509,180.756,43.765,59.454,124.091,4.218,65.22,39.217,1.74,26.853,6.919,2.997,11.82,179.323,30.517,25.726,2.064,1.269,1.628,22.215,1.61,2.679,2.5,1.246,4.475,9.083,74.286,55.892,19.477,27.684,11.93,18.876,11.82,179.323,41.776,57.377,178.579,122.492,14.636,62.684,20.629,7.094,39.104,33.174,36.601,5,13,16,11,2,8,21,1,1,9,29,28,15,2,16,14,4,22,26,24,4,2,3,2,3,1,2,2,1,5,4,2,1,1,1,1,1,4,50,Si,$3.25 ,1.5,42.561,39.17,36.378,33.787,41.785,12.599,14.851,18.732,1.269,0.832,41.883,37.43,18.732,28.737,0.832,3,8,1,2,1,4,,2,20,2,,It is appropriate for me to keep a past relationship a secret in order to keep your partner happy and continue your relationship?,1,,2,15,6,6,5,4,4,7,7,7,7,72,30,29,31,,Yes,1
R_6mtAVgMiVU1DCE5,Default Response Set,Anonymous,1,0,10/21/15 18:00,10/21/15 18:29,1,,,,1,,,,1,1,,,,,2,4,,1,1,1,1,1,1,1,1,1,1,1,1,1,1,1,1,1,1,1,1,1,1,1,1,1,1,1,1,1,1,1,1,1,1,1,1,1,1,1,1,1,1,1,2,1,2,1,2,1,2,2,2,1,1,1,2,1,1,1,2,1,2,130.032,34.597,45.076,31.558,36.253,61.393,82.784,25.474,81.317,46.292,35.278,66.567,23.254,60.133,19.248,65.32,51.743,37.617,17.888,38.82,128.534,45.21,30.981,65.325,20.421,58.885,15.505,63.932,49.995,36.232,16.872,29.481,36.888,42.695,29.942,34.789,60.028,78.752,24.599,79.518,128.534,45.21,30.981,65.325,20.421,58.885,15.505,63.932,49.995,36.232,16.872,29.481,36.888,42.695,29.942,34.789,60.028,79.562,24.599,79.518,1,1,1,1,1,1,1,1,1,1,1,1,1,1,1,1,1,2,1,1,4,1,5,3,1,1,3,1,1,3,5,2,1,1,1,1,1,4,30,No,$2.25 ,5,44.654,45.138,39.661,44.261,39.212,41.87,41.7,34.814,21.609,35.602,41.87,41.7,34.814,43.209,35.602,1,1,1,4,1,,4,1,22,1,"The one with the STD, I had a relationship prior to getting an STD and the person I contracted it from did not tell me. ",Is it appropriate for you to maintain your previous relationship a secret in order to keep your partner happy and in order to keep the relationship alive?,1,,2,14,2,5,6,6,5,7,7,7,7,0,12,26,28,,Yes,1
R_bHh7BdeKgt7Ccvj,Default Response Set,Anonymous,1,0,10/21/15 17:15,10/21/15 18:41,1,,,,1,,,,1,1,,,,,2,4,,1,1,1,1,1,1,1,1,1,1,1,1,1,1,1,1,1,1,1,1,1,1,1,1,1,1,1,1,1,1,1,1,1,1,1,1,1,1,1,1,1,1,1,2,1,2,2,2,1,1,2,2,1,1,1,2,1,1,1,1,1,1,22.819,73.972,76.003,67.576,22.913,43.279,30.637,61.863,67.794,36.655,64.085,53.38,17.849,60.398,38.3,89.677,57.59,64.008,48.113,29.588,21.408,35.733,62.946,49.749,16.713,54.668,37.365,88.176,56.549,63.187,46.78,72.724,28.172,75.012,63.441,21.854,39.321,29.566,55.56,66.661,21.408,35.733,62.946,49.749,16.713,54.668,37.365,89.192,56.549,63.187,46.78,72.724,28.172,75.012,63.441,21.854,39.321,29.566,55.56,66.661,1,1,1,1,1,1,1,2,1,1,1,1,1,1,1,1,1,1,1,1,4,2,4,2,2,3,3,2,2,4,4,2,1,1,1,1,1,4,29,si,$2.25 ,4.25,129.546,55.045,75.876,48.034,144.459,13.633,1.026,12.014,41.869,1.193,129.06,1.026,12.014,41.869,1.193,3,1,1,1,1,,4,1,22,1,the surgeon questions are very typical in medical ethics courses / the running the car off the road questions are often brought up in philosophy courses,Is it apropriat for you to mantain in secret you previous relationship in order to be able to maintain your partner's happiness and keep the relationship alive?,1,,1,15,0,2,6,5,5,7,7,7,7,8,22,33,67,no,Yes,1
R_3Kv3ufzvp3zLhoV,Default Response Set,Anonymous,1,0,10/21/15 18:19,10/21/15 18:52,1,,,,1,,,,1,1,,,,,2,4,,1,1,1,1,1,1,1,1,1,1,1,1,1,1,1,1,1,1,1,1,1,1,1,1,1,1,1,1,1,1,1,1,1,1,1,1,1,1,1,1,1,1,1,1,1,2,2,2,1,1,2,2,1,1,1,1,1,2,1,1,2,2,13.691,64.625,108.366,43.057,58.635,41.506,28.865,61.435,54.59,69.78,43.586,35.352,65.898,65.75,30.754,35.197,82.672,89.982,43.839,49.41,12.552,67.902,42.337,33.987,64.709,63.208,29.381,33.734,48.12,87.57,41.753,63.18,42.143,106.534,39.645,57.274,33.631,24.563,59.706,53.502,12.552,69.353,42.337,33.987,64.709,65.323,29.381,33.734,48.12,87.57,41.753,63.18,42.143,106.534,39.645,57.274,33.631,24.563,59.706,53.502,1,2,1,1,1,2,1,1,1,1,1,1,1,1,1,1,1,1,1,1,4,2,5,2,1,4,4,1,2,5,5,4,1,1,1,1,1,4,29,S,$3.25 ,5 horas / ,169.298,65.179,35.58,82.017,81.903,1.604,0.992,1.027,3.118,1.364,163.329,58.61,1.027,77.928,77.006,2,4,1,11,6,,4,2,19,2,,Do you think it's appropriate to keep your past relationship a secret in order to keep your current partner happy and keep your relationship alive?,1,,1,14,0.5,5,6,6,6,7,7,7,7,0,20,38,21,N/a,Yes,1
R_cUwD6D1QYQOZ6Yd,Default Response Set,Anonymous,1,0,10/21/15 18:14,10/21/15 18:55,1,,,,1,,,,1,1,,,,,2,,4,1,1,1,1,1,1,1,1,1,1,1,1,1,1,1,1,1,1,1,1,1,1,1,1,1,1,1,1,1,1,1,1,1,1,1,1,1,1,1,1,1,1,1,2,1,2,2,2,1,1,2,2,1,1,1,2,1,2,1,1,2,2,64.837,72.83,78.093,49.295,44.428,59.625,69.678,89.317,83.48,46.405,81.155,42.781,119.265,109.649,42.16,73.687,59.355,73.896,61.401,55.562,57.809,40.711,79.792,39.034,41.078,108.47,37.384,71.879,57.565,68.684,9.718,70.528,29.498,76.746,47.705,38.41,57.65,63.301,85.736,5.491,57.809,44.535,79.792,39.034,66.936,108.47,37.384,71.879,57.565,68.684,60.36,70.528,53.536,76.746,47.705,38.41,57.65,63.301,85.736,81.917,1,2,1,1,9,1,1,1,1,1,3,1,2,1,1,1,1,1,1,2,5,1,4,1,2,1,4,1,1,1,4,1,1,1,1,1,1,4,30,no,2.25,5,87.883,125.578,89.186,77.51,88.404,1.611,1.593,34.615,1.408,1.465,1.611,117.967,34.615,1.408,73.819,1,7,1,1,3,4,,2,22,1,The one about driving and having to decide between hitting the mother and child or the old woman.,Is it appropriate for me to keep secret my previous relationship so I can keep my partner happy and maintain our relationship?,1,,2,15,7,5,4,6,5,7,7,7,7,0,10,20,30,"I liked the order of the questions, I definitely would've changed answers had the pairs come in the opposite order - especially the Adolf Hitler/George Brackman question.",Yes,1
R_9mKV71rTTAqLey9,Default Response Set,Anonymous,1,0,10/21/15 17:46,10/21/15 18:55,1,,,,1,,,,1,1,,,,,2,4,,1,1,1,1,1,1,1,1,1,1,1,1,1,1,1,1,1,1,1,1,1,1,1,1,1,1,1,1,1,1,1,1,1,1,1,1,1,1,1,1,1,1,2,2,1,1,2,2,1,1,2,2,1,2,2,2,1,2,1,1,1,2,96.574,211.424,83.171,280.387,81.651,71.457,157.214,42.83,67.347,202.016,275.949,89.482,89.753,143.194,112.19,133.758,163.479,97.312,74.923,100.624,64.634,200.055,214.7,63.844,85.558,141.617,60.327,86.742,154.656,95.324,73.327,74.48,53.865,80.577,207.516,79.029,69.476,154.985,39.273,61.144,93.904,200.055,214.7,86.477,85.558,141.617,60.327,86.742,162.288,95.324,73.327,74.48,53.865,80.577,207.516,79.029,70.238,154.985,39.273,61.144,3,1,1,2,1,1,1,1,3,1,1,1,1,1,1,1,2,1,1,1,4,2,4,4,2,2,2,4,2,2,3,2,1,1,1,1,1,9,30,No,$2.25 ,3,213.178,84.347,37.954,98.22,140.022,126.905,25.954,19.626,34.683,133.533,211.729,25.954,19.626,34.683,133.533,2,1,1,1,1,,4,1,23,2,,"In your opinion, is it appropriate to keep a past relationship a secret in order to keep your current partner happy and healthy in your relationship?",1,,2,13,1,5,5,5,5,7,7,7,7,0,4,4,3,,Yes,1
R_9So9uYkFiQFQvqJ,Default Response Set,Anonymous,1,0,10/21/15 18:49,10/21/15 19:10,1,,,,1,,,,1,1,,,,,2,,4,1,1,1,1,1,1,1,1,1,1,1,1,1,1,1,1,1,1,1,1,1,1,1,1,1,1,1,1,1,1,1,1,1,1,1,1,1,1,1,1,1,1,1,2,1,2,2,2,1,1,1,2,1,1,1,1,1,2,1,2,1,2,29.134,30.261,40.718,97.694,28.628,24.942,21.61,34.143,19.693,47.085,33.025,30.887,20.819,34.062,46.064,20.33,26.602,31.532,25.639,15.424,28.418,46.258,32.415,29.457,20.072,33.273,45.199,19.683,25.828,30.797,24.779,29.484,14.673,39.259,96.962,27.734,24.194,20.101,33.608,18.601,28.418,46.258,32.415,29.457,20.072,33.273,45.199,19.683,25.828,30.797,24.779,29.484,14.673,39.736,96.962,27.734,24.194,20.896,33.608,19.064,1,1,1,1,1,1,1,1,1,1,1,1,1,2,1,1,1,2,1,2,3,4,4,2,1,2,4,1,2,4,3,5,1,1,1,1,1,18,30,Si ,2.25,3,20.413,28.219,22.988,43.074,39.996,10.424,5.517,18.748,0.986,9.826,10.424,5.517,18.748,0.986,9.826,1,1,1,1,1,4,,2,23,2,,Is it appropriate for you to maintain in secret your previous relationship to be able  to keep your partner happy and keep alive your current relationship?,1,,2,12,3,5,4,6,7,7,7,7,7,0,15,15,10,,Yes,1
R_efyKU7WsgrTuksJ,Default Response Set,Anonymous,1,0,10/21/15 18:58,10/21/15 20:01,1,,,,1,,,,1,1,,,,,2,,4,1,1,1,1,1,1,1,1,1,1,1,1,1,1,1,1,1,1,1,1,1,1,1,1,1,1,1,1,1,1,1,1,1,1,1,1,1,1,1,1,1,1,1,2,2,2,2,2,2,2,2,2,1,1,1,1,1,1,2,2,2,2,21.026,160.608,14.353,190.276,14.039,9.441,6.595,106.58,38.381,62.476,9.413,42.077,150.305,5.038,106.389,84.81,33.627,10.085,21.39,50.925,18.612,49.512,3.111,40.404,38.42,3.806,104.617,14.436,5.693,8.682,17.989,86.182,48.934,6.797,7.098,12.763,5.659,5.316,105.142,36.154,18.612,49.512,8.004,40.404,148.392,3.806,104.617,83.571,32.242,8.682,17.989,158.825,48.934,6.797,188.878,12.763,5.659,5.316,105.142,36.154,1,1,4,1,26,1,1,5,6,1,1,2,1,1,7,1,1,1,1,1,5,1,5,4,2,3,4,2,1,4,4,4,1,1,1,1,1,18,30,S,$2.25 ,doce,48.951,42.097,17.852,29.766,74.765,41.317,12.777,6.983,24.457,62.494,41.317,13.619,6.983,24.457,62.494,1,4,1,1,1,4,,2,20,1,Mara getting good grades and feeling stressed because of financial aid and the pressure of paying for tuition.,Is it appropriate for you to keep secret your former relationship in order to keep your partner happy and keep the relationship alive?,1,,1,14,0,3,3,5,4,7,7,7,7,0,0,2,6,,Yes,1
R_5iHQfmrWdYTCDbv,Default Response Set,Anonymous,1,0,10/21/15 20:03,10/21/15 20:32,1,,,,1,,,,1,1,,,,,2,4,,1,1,1,1,1,1,1,1,1,1,1,1,1,1,1,1,1,1,1,1,1,1,1,1,1,1,1,1,1,1,1,1,1,1,1,1,1,1,1,1,1,1,1,2,1,2,2,2,1,2,2,2,1,1,1,2,2,2,1,1,1,2,40.213,23.938,19.514,41.414,23.793,33.986,35.279,27.961,56.993,60.211,66.554,35.063,32.216,80.217,24.366,29.397,34.246,45.494,34.26,55.043,38.943,58.337,65.553,32.746,31.164,58.907,22.69,28.182,32.662,44.385,32.396,23.008,52.992,18.478,39.842,22.96,31.722,30.767,26.919,55.857,38.943,58.337,65.553,32.746,31.164,79.354,22.69,28.182,32.662,44.385,33.404,23.008,52.992,18.478,39.842,22.96,31.722,31.409,26.919,55.857,1,1,1,1,1,2,1,1,1,1,2,1,1,1,1,1,1,2,1,1,4,2,5,3,2,4,3,1,1,2,3,4,1,1,1,1,1,4,29,no,$2.25 ,5 horas,229.322,43.211,23.484,30.758,66.751,108.779,31.225,21.571,5.723,62.087,208.142,42.758,21.571,25.461,62.087,2,2,1,2,1,,4,2,22,2,,Is is appropriate to keep your past relationship a secret to keep your relationship happy and alive?,1,,2,10,4,6,7,7,7,7,7,7,7,0,9,20,10,nope,Yes,1
R_9LAhk99RxmsQ0hD,Default Response Set,Anonymous,1,0,10/21/15 20:54,10/21/15 21:29,1,,,,1,,,,1,1,,,,,2,4,,1,1,1,1,1,1,1,1,1,1,1,1,1,1,1,1,1,1,1,1,1,1,1,1,1,1,1,1,1,1,1,1,1,1,1,1,1,1,1,1,1,1,1,2,2,2,2,2,2,2,2,2,1,1,2,2,1,2,1,2,2,2,25.142,24.561,81.304,15.64,14.887,28.224,32.83,221.664,34.188,131.68,26.13,75.848,15.964,46.684,62.59,34.664,22.238,52.386,35.184,24.991,23.276,129.809,25.021,68.229,14.801,44.254,61.399,25.374,21.096,50.958,34.193,22.584,14.595,80.09,13.348,13.789,26.604,29.38,97.097,29.767,23.276,129.809,25.021,68.229,14.801,44.254,61.399,25.374,21.096,50.958,34.193,22.584,14.595,80.09,13.348,13.789,26.604,29.38,220.107,29.767,1,1,1,1,1,1,1,1,1,1,1,1,1,1,1,1,1,1,2,1,4,1,4,3,4,2,3,2,1,5,4,3,1,1,1,1,1,8,30,No,$2.25 ,5 horas,119.8,73.174,37.872,378.539,51.369,78.828,7.818,23.854,1.531,45.931,107.599,68.551,23.854,1.531,45.931,2,2,1,1,1,,4,2,22,2,,Is it appropriate for you to maintain in secret your previous relationship to keep your partner happy and keep the relationship alive?,1,,1,13,4,7,6,5,5,7,7,7,7,0,2,3,1,,Yes,1
R_3HLhBNgce4sQz77,Default Response Set,Anonymous,1,0,10/21/15 20:23,10/21/15 21:29,1,,,,1,,,,1,1,,,,,2,,4,1,1,1,1,1,1,1,1,1,1,1,1,1,1,1,1,1,1,1,1,1,1,1,1,1,1,1,1,1,1,1,1,1,1,1,1,1,1,1,1,1,1,1,3,1,2,2,2,1,1,2,2,1,1,1,1,1,1,2,2,2,2,127.194,67.823,734.268,84.639,67.001,17.214,27.802,49.874,448.161,143.804,136.458,73.633,172.468,20.497,27.418,8.562,31.32,67.561,16.458,42.621,12.849,64.868,116.585,6.914,116.181,19.235,26.494,6.975,26.211,51.41,15.267,65.76,37.342,463.54,82.81,64.287,15.556,19.537,48.471,122.719,124.512,64.868,130.114,49.225,171.081,19.235,26.494,6.975,30.363,66.339,15.267,65.76,37.935,732.23,82.81,64.287,15.556,22.246,48.471,446.516,3,1,2,5,4,1,1,1,3,3,1,1,2,7,1,1,1,2,1,3,4,4,4,5,2,1,3,2,2,2,3,2,1,1,1,1,1,9,30,No,$1.75 ,Tomara la concentracin 64x,121.324,210.876,393.672,136.399,138.131,1.605,1.162,4.489,1.458,1.872,116.033,6.812,4.489,128.57,109.364,3,3,1,12,5,4,,2,21,2,,Is it appropriate to keep a secret from your relationship to maintain a happy relationship and keep the relationship living?,1,,1,18,1,5,6,5,5,7,7,7,7,15,24,28,32,"Hard questions, hope you get the results you're looking for :)",Yes,1
R_72I5fHKX5UvXVzL,Default Response Set,Anonymous,1,0,10/21/15 21:17,10/21/15 21:42,1,,,,1,,,,1,1,,,,,2,4,,1,1,1,1,1,1,1,1,1,1,1,1,1,1,1,1,1,1,1,1,1,1,1,1,1,1,1,1,1,1,1,1,1,1,1,1,1,1,1,1,1,1,1,2,1,2,2,2,1,1,2,2,1,1,1,2,1,2,1,2,2,2,31.904,27.607,43.253,45.742,23.663,32.578,38.113,66.657,49.257,32.151,31.941,24.06,36.748,60.448,29.555,24.044,24.338,39.89,31.225,16.973,29.103,30.068,30.313,22.349,35.175,58.095,28.007,22.233,22.79,37.574,27.779,24.111,14.587,41.16,42.063,21.793,31,35.999,64.908,47.795,29.103,30.068,30.313,22.349,35.175,58.095,28.007,22.233,22.79,37.574,29.171,24.111,14.587,41.16,42.063,21.793,31,35.999,64.908,47.795,1,1,1,1,1,1,1,1,1,1,2,1,1,1,1,1,1,1,1,1,5,1,5,1,2,3,4,1,1,5,4,1,1,1,1,1,1,4,30,Si,$2.25 ,3 horas,102.006,19.201,30.385,45.73,123.187,95.275,14.32,22.014,10.139,118.941,95.275,14.32,26.661,10.139,118.941,1,1,3,1,1,,2,2,24,1,The scenario with the border patrol officer making the decision about killing the approaching man.,Is it appropriate for you to keep your former relationship a secret in order to keep your partner happy and keep the relationship afloat?,1,,2,13,9,6,7,7,6,7,7,7,7,0,35,60,40,"Very interesting, though I wonder how you're able to establish language proficiency / if that ever affects your results because people don't actually understand the situations but do not want to admit it...",Yes,1
R_00So3UKTmmlqjm5,Default Response Set,Anonymous,1,0,10/21/15 22:32,10/21/15 23:16,1,,,,1,,,,1,1,1,,,,2,,4,1,1,1,1,1,1,1,1,1,1,1,1,1,1,1,1,1,1,1,1,1,1,1,1,1,1,1,1,1,1,1,1,1,1,1,1,1,1,1,1,1,1,1,1,1,2,2,2,1,2,2,2,1,1,1,2,1,2,1,2,2,2,11.241,43.606,78.555,31.577,27.878,28.145,31.603,62.16,35.634,11.822,32.26,23.194,14.437,62.231,17.23,32.432,197.141,18.158,28.115,19.411,9.591,6.868,30.759,19.832,13.101,50.75,16.054,31.131,118.065,16.834,27.205,42.75,18.088,77.401,30.53,26.8,27.225,30.07,60.84,34.381,9.591,6.868,30.759,19.832,13.101,50.75,16.054,31.131,196.193,16.834,27.205,42.75,18.088,77.401,30.53,26.8,27.225,30.07,60.84,34.381,1,1,1,1,1,1,1,1,2,1,1,1,1,1,1,1,1,1,1,1,5,1,5,2,3,1,3,2,1,3,4,1,1,1,1,1,1,No entiendo la pregunta.,29,No -- no todo que tiene ptalo es una flor.,$2.25 ,5 horas,231.509,52.494,78.787,87.39,118.142,22.763,46.532,12.84,75.793,111.776,226.901,46.532,12.84,75.793,111.776,4,1,1,1,1,4,,2,22,1,"(if familiar in relation to other questions I had read previously) The one about the soldier, the medicine, the bus driver, shooting the man running towards you, torturing the man who is bombing,  /  / (if familiar as in I have experienced one or more of these scenarios): no","In your opinion, is it appropriate to keep a past relationship secret in order to keep your partner happy and preserve your current relationship?",1,,2,15,0,5,7,4,5,7,7,7,7,4,4,6,4,"Fix grammar errors, one question (about the beber agua) seemed unclear.",Yes,1
R_cU4uIVzV3etCFj7,Default Response Set,Anonymous,1,0,10/21/15 21:54,10/22/15 0:08,1,,,,1,,,,1,1,,,,,2,,4,1,1,1,1,1,1,1,1,1,1,1,1,1,1,1,1,1,1,1,1,1,1,1,1,1,1,1,1,1,1,1,1,1,1,1,1,1,1,1,1,1,1,1,1,1,2,2,2,1,1,2,2,1,2,1,3,1,1,1,1,2,2,47.826,36.318,77.636,37.687,78.36,31.447,55.565,118.731,105.321,67.22,53.579,177.46,197.293,272.649,163.287,24.604,106.616,139.771,171.025,23.352,38.995,64.96,52.084,171.355,46.833,271.159,161.463,22.829,105.742,138.273,169.799,1.053,21.173,76.522,36.544,73.531,29.619,53.22,116.882,102.679,38.995,64.96,52.084,171.355,196.068,271.159,161.463,22.829,105.742,138.273,169.799,30.863,21.173,76.522,36.544,75.663,29.619,53.22,118.107,102.679,1,1,1,1,5,1,1,1,1,1,1,3,1,1,1,2,1,1,2,1,4,3,3,2,4,2,3,4,3,2,3,1,1,1,1,1,1,4,29,"No, porque aunque todas las flores tienen ptalos, no todas las cosas que tienen ptalos son flores.",La ensalada cuesta $2.25.,5 horas,128.918,35.629,2262.91,2680.189,95.264,2.677,1.224,4.909,1238.321,21.224,126.041,33.54,659.473,2679.251,36.521,6,2,3,4,3,4,,1,19,2,,Is it appropriate for you to keep your previous relationship secret to be able to keep your partner happy and keep the relationship alive?,1,,1,14,1,3,3,6,5,7,7,7,7,14,5,17,22,,Yes,1
R_d7tSCYtL9agV72l,Default Response Set,Anonymous,1,0,10/22/15 9:10,10/22/15 11:05,1,,,,1,,,,1,1,1,,,,2,4,,1,1,1,1,1,1,1,1,1,1,1,1,1,1,1,1,1,1,1,1,1,1,1,1,1,1,1,1,1,1,1,1,1,1,1,1,1,1,1,1,1,1,1,1,1,1,2,2,1,2,2,2,1,1,1,2,1,1,1,1,2,2,37.077,71.736,42.177,63.926,44.961,38.562,49.872,82.472,75.363,160.541,53.953,42.067,54.012,68.771,24.056,29.645,39.986,33.93,78.501,81.087,34.012,159.151,52.156,35.385,49.93,67.368,20.044,27.742,38.676,32.376,75.053,65.226,78.968,40.565,61.687,43.529,36.789,46.574,80.857,73.53,34.012,159.151,52.156,40.718,49.93,67.368,20.044,27.742,38.676,32.376,75.053,65.226,78.968,40.565,61.687,43.529,36.789,46.574,80.857,73.53,1,1,1,2,1,1,1,1,1,1,1,1,1,1,1,1,1,1,1,1,3,1,4,5,2,2,4,4,4,4,2,2,1,1,1,1,1,9,15,S,$2.25 ,5,22.374,36.799,40.6,67.401,89.662,19.236,3.747,33.691,62.204,80.711,19.236,3.747,33.691,62.204,80.711,1,1,1,1,1,,4,1,21,1,"The fast-moving car, the use of chemicals in animals, the baby crying amidst the soldiers",Is it appropriate to keep your previous relationship a secret in order to be able to maintain a happy couple and let the relationship live on?,1,,1,15,2,6,6,7,6,7,7,7,7,0,0,8,9,No,Yes,1
R_6g8bPs4at1Nbllz,Default Response Set,Anonymous,1,0,10/22/15 9:57,10/22/15 11:39,1,,,,1,,,,1,1,,1,1,"Farsi, Hebreo, Italiano",2,,4,1,1,1,1,1,1,1,1,1,1,1,1,1,1,1,1,1,1,1,1,1,1,1,1,1,1,1,1,1,1,1,1,1,1,1,1,1,1,1,1,1,1,1,1,1,2,2,2,1,1,2,2,1,1,1,1,1,2,1,2,2,2,108.927,50.548,60.827,140.907,70.627,51.519,175.133,37.164,134.67,91.922,197.715,146.051,58.703,37.292,43.543,37.585,175.755,129.192,13.326,103.645,40.824,36.263,193.535,133.948,51.056,27.433,41.557,23.276,161.873,127.447,12.04,49.075,82.537,58.67,138.012,51.096,45.398,171.382,34.448,105.6,40.824,90.13,193.535,133.948,51.056,27.433,41.557,23.276,161.873,127.447,12.04,49.075,82.537,58.67,138.012,51.096,45.398,171.382,34.448,105.6,1,5,1,1,1,1,1,1,1,1,1,1,1,1,1,1,1,1,1,1,5,1,5,1,2,1,5,1,1,5,5,1,1,1,1,1,1,4,30,no,$2.25 ,5 horas,62.73,11.943,16.113,20.981,28.973,1.595,7.211,3.123,1.547,12.697,1.595,7.211,3.123,1.547,12.697,1,1,1,1,1,4,,2,19,2,,Do you think it's appropriate to keep your previous relationship a secret in order to keep your partner happy and to maintain the relationship?,1,,2,13,1,6,6,6,6,7,7,7,7,0,0,40,40,,Yes,1
R_9ZbFfFA5UFCQnNb,Default Response Set,Anonymous,1,0,10/22/15 11:20,10/22/15 11:44,1,,,,1,,,,1,1,,,,,2,4,,1,1,1,1,1,1,1,1,1,1,1,1,1,1,1,1,1,1,1,1,1,1,1,1,1,1,1,1,1,1,1,1,1,1,1,1,1,1,1,1,1,1,1,2,2,1,2,2,1,1,2,2,1,1,2,2,1,2,1,2,1,2,14.679,36.355,42.329,64.572,18.635,34.126,31.957,88.791,81.107,24.053,28.962,52.339,43.729,32.376,22.226,37.231,20.332,29.285,16.256,23.933,13,23.003,28.108,51.015,38.833,31.386,21.252,18.91,19.35,28.407,14.891,35.269,23.079,41.403,59.943,17.485,33.006,29.658,87.435,80.294,13,23.003,28.108,51.015,38.833,31.386,21.252,18.91,19.35,28.407,14.891,35.269,23.079,41.403,59.943,17.485,33.006,29.658,87.435,80.294,1,1,1,1,1,1,1,1,1,1,1,1,1,1,1,1,1,1,1,1,4,1,5,4,1,1,4,1,1,4,4,2,1,1,1,1,1,4,43,No,2.25,5,79.465,65.529,21.014,33.919,58.958,77.422,9.67,1.39,1.506,2.759,77.422,61.155,1.39,28.83,2.759,1,3,1,2,1,,4,2,23,2,,Is it appropriate for you to keep your previous relationship secret so that you can keep your partner happy and keep your relationship alive?,1,,2,14,4,5,5,6,5,7,7,7,7,0,5,10,10,"I wish there had been a ""Not sure"" option for some of the scenarios, because it was hard for me to decide strictly ""yes/no"" if something was a moral choice or not! ",Yes,1
R_a64IYQsp8ZRr18p,Default Response Set,Anonymous,1,0,10/21/15 22:45,10/22/15 13:44,1,,,,1,,,,1,1,,,1,rabe,2,4,,1,1,1,1,1,1,1,1,1,1,1,1,1,1,1,1,1,1,1,1,1,1,1,1,1,1,1,1,1,1,1,1,1,1,1,1,1,1,1,1,1,1,1,1,1,2,2,2,2,2,2,2,2,1,1,1,2,2,1,2,1,2,43.892,177.733,51.219,20.312,303.727,15.403,55.016,56.68,79.141,43.706,125.702,30.296,30.725,28.157,21.781,52.335,46.808,47.925,27.713,27.752,42.16,42.428,4.563,27.407,28.365,26.421,19.226,18.439,42.544,46.189,26.388,175.045,4.595,49.317,18.934,301.704,14.156,29,38.216,75.688,42.494,42.428,58.231,27.407,29.342,26.862,19.226,18.439,42.544,46.189,26.388,175.045,26.44,49.317,18.934,302.116,14.156,53.134,38.216,75.688,2,1,4,1,2,2,1,1,1,1,1,1,2,1,1,2,1,3,1,1,5,1,4,5,1,2,3,3,3,2,4,4,1,1,1,1,1,4,29,s,$2.20 ,Hora 5,486.652,110.337,17.826,27.766,87.589,6.536,2.8,3.57,7.254,24.125,406.327,104.177,8.266,25.116,85.163,9,2,2,2,2,,4,2,20,2,,Is it appropriate for you to keep your previous relationship a secret if it keeps your partner happy and maintains a happy relationship? ,1,,1,8,0,4,6,6,6,7,7,7,7,0,2,0,0,,Yes,1
R_b9O5mTPz1GvTCgR,Default Response Set,Anonymous,1,0,10/22/15 13:53,10/22/15 14:14,1,,,,1,,,,1,1,1,,,,2,,4,1,1,1,1,1,1,1,1,1,1,1,1,1,1,1,1,1,1,1,1,1,1,1,1,1,1,1,1,1,1,1,1,1,1,1,1,1,1,1,1,1,1,1,2,1,2,2,2,1,2,2,2,1,2,2,2,1,2,1,2,2,2,8.483,29.88,26.507,16.091,29.247,21.177,44.461,36.983,17.405,34.994,37.139,25.001,36.45,28.993,18.347,32.23,72.803,16.43,20.545,22.29,6.825,34.208,36.313,23.879,35.071,28.319,12.662,23.125,70.377,15.363,18.895,29.189,21.216,25.624,15.368,27.659,20.479,43.555,21.877,16.682,6.825,34.208,36.313,23.879,35.071,28.319,12.662,23.125,71.857,15.363,20.167,29.189,21.216,25.624,15.368,27.659,20.479,43.555,32.332,16.682,1,1,1,1,1,1,1,1,2,1,2,1,1,1,1,1,1,1,4,1,4,1,5,4,1,1,5,4,2,3,3,3,1,1,1,1,1,4,30,No,2.25,3 horas.,130.113,31.458,25.894,41.144,40.688,6.914,1.096,1.55,1.174,1.13,6.914,1.096,1.55,17.086,1.13,1,1,1,2,1,4,,2,20,2,,Is it appropriate to keep your previous relationship a secret to make sure that your partner stays happy and that you stay in your relationship?,1,,2,4,4,6,6,6,6,7,7,7,7,0,5,5,0,,Yes,1
R_6KHKTldkD46xhat,Default Response Set,Anonymous,1,0,10/22/15 18:50,10/22/15 21:51,1,,,,1,,,,1,1,,,,,2,,4,1,1,1,1,1,1,1,1,1,1,1,1,1,1,1,1,1,1,1,1,1,1,1,1,1,1,1,1,1,1,1,1,1,1,1,1,1,1,1,1,1,1,2,2,1,2,2,2,2,2,2,2,1,2,2,2,2,2,1,2,2,2,35.979,38.899,18.365,37.211,28.477,25.559,9208.118,37.975,19.975,44.588,123.059,42.885,23.353,52.175,20.586,24.16,116.552,46.844,28.81,25.743,34.863,24.233,113.165,40.931,22.245,49.444,19.32,23.235,115.118,45.807,23.508,37.431,7.584,17.224,35.147,27.484,24.406,9207.048,35.538,18.581,34.863,43.396,114.569,40.931,22.245,49.444,19.32,23.235,115.118,45.807,23.508,37.431,24.417,17.224,35.147,27.484,24.406,9207.048,35.538,18.581,1,3,2,1,1,1,1,1,1,1,1,1,3,1,1,1,1,1,1,1,4,1,5,1,3,2,5,2,1,4,4,2,1,1,1,1,1,4,30,No,$2.25 ,5 horas,78.824,31.712,41.721,39.512,47.857,14.821,29.408,39.837,20.29,2.733,14.821,29.408,39.837,36.547,2.733,1,1,1,2,1,4,,2,20,1,The abortion scenarios sounded familiar,Is it appropriate for you to keep you prior relationship secret in order to be able to keep your partner happy and maintain the relationship?,1,,2,13,3,5,5,6,7,7,7,7,7,0,12,16,12,I would recommend including a debriefing section that explains the purpose of this study to the participants.,Yes,1
R_4Ga0zcYjAMjwx4V,Default Response Set,Anonymous,1,0,10/22/15 22:35,10/22/15 23:39,1,,,,1,,,,,1,,,,,2,4,,1,1,1,1,1,1,1,1,1,1,1,1,1,1,1,1,1,1,1,1,1,1,1,1,1,1,1,1,1,1,1,1,1,1,1,1,1,1,1,1,1,1,1,2,1,1,2,2,1,1,2,2,1,1,1,1,1,1,2,2,2,2,46.753,15.081,4.964,37.059,29.164,4.679,60.354,5.444,2938.218,3.761,34.091,5.947,60.357,3.486,28.318,3.305,7.048,4.901,26.832,7.972,45.229,2.764,33.123,4.204,59.484,2.621,27.392,2.453,5.598,3.677,25.35,13.991,4.637,3.918,26.302,27.636,3.302,57.124,2.728,2936.849,45.229,2.764,33.123,4.204,59.484,2.621,27.392,2.453,5.598,3.677,25.35,13.991,6.485,3.918,26.302,27.636,3.302,57.124,3.288,2936.849,1,1,1,1,1,1,1,1,1,1,1,1,2,1,1,1,1,1,2,1,5,1,5,1,1,2,3,1,5,5,5,5,1,1,1,1,1,9,100,no,2.25,3 horas,33.694,26.048,24.603,23.877,41.164,1.448,0.681,4.136,1.456,1.581,1.448,0.681,19.904,1.456,34.139,1,1,4,1,2,,4,2,22,1,all of them,is is appropriate to maintain your previous relationship in secret in order to be able to keep your partner happy and give life to the relationship ,1,,1,14,1,6,7,7,7,7,7,7,7,6,27,85,88,,Yes,1
R_bjDcCs1qAMkCNDv,Default Response Set,Anonymous,1,0,10/23/15 11:16,10/23/15 12:04,1,,,,1,,,,1,1,,,,,2,,4,1,1,1,1,1,1,1,1,1,1,1,1,1,1,1,1,1,1,1,1,1,1,1,1,1,1,1,1,1,1,1,1,1,1,1,1,1,1,1,1,1,1,2,2,1,1,2,2,1,1,2,2,1,1,1,2,1,2,1,2,2,2,102.379,69.218,46.887,121.751,32.334,85.869,75.151,80.61,88.177,105.274,109.453,33.443,90.986,60.498,46.321,44.038,119.381,62.505,51.075,66.243,93.131,103.098,108.609,32.063,89.674,59.05,44.737,18.96,104.311,60.496,40.212,67.89,64.25,44.95,3.278,31.054,84.425,71.755,79.189,16.738,99.292,103.098,108.609,32.063,89.674,59.05,44.737,39.655,118.189,61.97,40.212,67.89,64.699,44.95,120.513,31.054,84.425,71.755,79.189,86.456,2,1,1,1,1,1,1,2,2,2,1,1,2,1,2,1,1,1,1,5,5,1,5,4,2,2,4,2,2,5,3,5,1,1,1,1,1,4,29,No,La ensalada cuesta $2.25.,Ella tendra que beber por 12 horas.,164.67,137.796,32.664,84.329,155.215,4.411,1.471,1.303,1.403,1.6,144.16,135.754,26.041,9.164,1.6,10,5,4,2,1,4,,1,19,1,I had heard the wartime/baby crying scenario in a few ethics and political science courses.,Is it appropriate for you to keep your prior relationship secret in order to maintain your partner's happiness and keep alive the relationship?,1,,1,15,0,4,3,5,4,7,7,7,7,0,1,4,8,Yay Spanish!,Yes,1
